{
  "$schema": "https://json-schema.org/draft/2020-12/schema",
  "$id": "https://github.com/alexhawat/bs_score/blob/main/findings.schema.json",
  "title": "BsScoreFindings",
  "description": "Contract for LLM-emitted bs_score findings. bs-score enforces this schema in full (types, enums, minLength, numeric bounds, additionalProperties) before scoring.",
  "type": "object",
  "required": ["version", "target_kind", "findings"],
  "additionalProperties": false,
  "properties": {
    "version": {
      "type": "integer",
      "enum": [1, 2],
      "description": "Payload contract version. 2 is current; 1 is still accepted."
    },
    "target_kind": {
      "type": "string",
      "enum": ["repo", "pr", "branch", "review", "skill", "agent", "prompt", "docs"],
      "description": "Review type. Selects the weight profile in scoring.json."
    },
    "target_ref": {
      "type": "string",
      "minLength": 1,
      "description": "Optional locator: repo URL or commit, PR/branch, review id, skill path, agent path, or prompt-set name."
    },
    "findings": {
      "type": "array",
      "items": {
        "type": "object",
        "required": ["id", "type", "title", "path", "quote", "target"],
        "additionalProperties": false,
        "properties": {
          "id": {
            "type": "string",
            "minLength": 1,
            "description": "Unique within the payload."
          },
          "type": {
            "type": "string",
            "enum": ["breaking_bug", "security_issue", "missing_feature", "bug", "wrong_claim"]
          },
          "title": { "type": "string", "minLength": 1 },
          "path": {
            "type": "string",
            "minLength": 1,
            "description": "Evidence locator. File form: README.md, src/api.py:88, src/api.py:88-95. Review form: pull/<n>/reviews/<id>[#suffix]. Prompt form: prompt:<prompt-id>[:<line>] resolved against --prompts, or a plain file path when the prompt is stored in the repo."
          },
          "quote": {
            "type": "string",
            "minLength": 1,
            "description": "Verbatim excerpt from the artifact at `path`. Verified byte-for-byte (whitespace-normalised) by bs-score --repo-root; a quote that is not present is not scored."
          },
          "claim": {
            "type": "string",
            "minLength": 1,
            "description": "Optional: the stated claim being audited."
          },
          "confidence": {
            "type": "number",
            "minimum": 0,
            "maximum": 1,
            "description": "Display-only; does not affect the score."
          },
          "target": {
            "type": "string",
            "enum": ["readme", "code", "diff", "review", "skill", "agent", "prompt", "other"]
          }
        }
      }
    }
  }
}
