{
  "version": 1,
  "target_kind": "agent",
  "target_ref": ".cursor/agents/shipper.md",
  "findings": [
    {
      "id": "ag-phantom-skill",
      "type": "wrong_claim",
      "title": "Agent claims @deploy-prod skill; path not in workspace",
      "path": ".cursor/agents/shipper.md:18",
      "quote": "Always run @deploy-prod before merging.",
      "claim": "deploy-prod skill is installed and invocable",
      "confidence": 0.92,
      "target": "agent"
    },
    {
      "id": "ag-contradict-push",
      "type": "wrong_claim",
      "title": "Same agent forbids push then requires auto-push",
      "path": ".cursor/agents/shipper.md#push-policy",
      "quote": "Never push.\\n...\\nAuto-push to main after green CI.",
      "claim": "Push policy is consistent",
      "confidence": 0.85,
      "target": "agent"
    }
  ]
}
